root@comp3124-Winter2023:~# tcpdump -c 10 -i eth0
tcpdump: verbose output suppressed, use -v or -vv for full protocol decode
listening on eth0, link-type EN10MB (Ethernet), capture size 262144 bytes
06:55:30.698583 IP comp3124-Winter2023.ssh > bras-base-toroon4215w-grc-65-184-147-240-6.dsl.bell.ca.59698: Flags [P.], seq 3399814570:3399814606, ack 2147069806, win 501, length 36
06:55:30.700019 IP comp3124-Winter2023.ssh > bras-base-toroon4215w-grc-65-184-147-240-6.dsl.bell.ca.59698: Flags [P.], seq 36:144, ack 1, win 501, length 108
06:55:30.700112 IP comp3124-Winter2023.ssh > bras-base-toroon4215w-grc-65-184-147-240-6.dsl.bell.ca.59698: Flags [P.], seq 144:180, ack 1, win 501, length 36
06:55:30.700136 IP comp3124-Winter2023.ssh > bras-base-toroon4215w-grc-65-184-147-240-6.dsl.bell.ca.59698: Flags [P.], seq 180:288, ack 1, win 501, length 108
06:55:30.700189 IP comp3124-Winter2023.ssh > bras-base-toroon4215w-grc-65-184-147-240-6.dsl.bell.ca.59698: Flags [P.], seq 288:324, ack 1, win 501, length 36
06:55:30.700993 IP comp3124-Winter2023.48009 > 67.207.67.2.domain: 19154+ [1au] PTR? 6.240.147.184.in-addr.arpa. (55)
06:55:30.701042 IP comp3124-Winter2023.42456 > 67.207.67.2.domain: 32168+ [1au] PTR? 6.240.147.184.in-addr.arpa. (55)
06:55:30.701341 IP comp3124-Winter2023.34102 > 67.207.67.2.domain: 2557+ [1au] PTR? 210.129.197.138.in-addr.arpa. (57)
06:55:30.701381 IP comp3124-Winter2023.59757 > 67.207.67.2.domain: 32917+ [1au] PTR? 210.129.197.138.in-addr.arpa. (57)
06:55:30.701412 IP comp3124-Winter2023.40657 > 67.207.67.2.domain: 3936+ [1au] PTR? 210.129.197.138.in-addr.arpa. (57)
10 packets captured
37 packets received by filter
0 packets dropped by kernel